{
  "actuarial_reconciliation": {
    "causation_status": "UNTESTED",
    "comparison_status": "DATA_INCOMPLETE",
    "delta_definition": null,
    "documented_refund_adjustment": null,
    "historical_charged_total": null,
    "limitations": [
      "Do not treat a TSM-modeled premium as a legally established correct premium.",
      "Risk Rating 2.0 is not by itself proof that a prior policy was misrated.",
      "Carrier, policy, coverage, deductible, fee, surcharge, rating-input, and refund records are required."
    ],
    "misrating_status": "UNTESTED",
    "modeled_comparison_premium": null,
    "observed_delta": null,
    "rr2_comparison_allowed": false
  },
  "case_metadata": {
    "analysis_status": "DATA_COLLECTION",
    "case_id": "26-05-2022A",
    "legal_theory_status": "HYPOTHESIS_ONLY"
  },
  "evidence_provenance": [
    {
      "acquisition_date": "2026-09-22",
      "evidence_id": "FEMA-26-05-2022A-001",
      "notes": "Original uploaded FEMA correspondence artifact.",
      "processing_status": "PRESERVED",
      "sha256": "8186cbf49bfa5ae415aacaf1b548f75fc02692a5793c30cdebb8cf7f6f20dcde",
      "source_locator": "26-05-2022A-092226.pdf",
      "source_type": "FEMA correspondence"
    },
    {
      "acquisition_date": "2026-09-22",
      "evidence_id": "FEMA-MT1-LEGACY-001",
      "notes": "Attachment visibly prints expiration February 28, 2014; record does not independently establish whether FEMA considers it obsolete, superseded, or acceptable.",
      "processing_status": "OBSERVED_REQUIRES_AGENCY_CONFIRMATION",
      "sha256": "8186cbf49bfa5ae415aacaf1b548f75fc02692a5793c30cdebb8cf7f6f20dcde",
      "source_locator": "26-05-2022A-092226.pdf",
      "source_type": "Attached MT-1 Form 2"
    },
    {
      "acquisition_date": null,
      "evidence_id": "USACE-HISTORY-001",
      "notes": "Do not infer current FEMA model dependency until primary records establish it.",
      "processing_status": "REQUESTED",
      "sha256": null,
      "source_locator": "USACE Louisville District FOIA request - Wabash/New Harmony navigation works",
      "source_type": "Primary historical engineering records"
    },
    {
      "acquisition_date": null,
      "evidence_id": "NFIP-PREMIUM-001",
      "notes": "Redact unnecessary PII.",
      "processing_status": "TO_COLLECT",
      "sha256": null,
      "source_locator": "Community intake / insurer / NFIP records",
      "source_type": "Policy and insurance records"
    },
    {
      "acquisition_date": null,
      "evidence_id": "FIRM-HISTORY-001",
      "notes": "Record panel, suffix, effective date, datum, and product type.",
      "processing_status": "TO_COLLECT",
      "sha256": null,
      "source_locator": "Historical FIRM/FIS panels and effective dates",
      "source_type": "FEMA Map Service Center"
    },
    {
      "acquisition_date": null,
      "evidence_id": "ELEVATION-001",
      "notes": "Record datum, control, method, date, and certification.",
      "processing_status": "TO_COLLECT",
      "sha256": null,
      "source_locator": "Licensed surveyor/PE supplied documentation",
      "source_type": "Certified elevation evidence"
    },
    {
      "evidence_id": "IN-GIO-DEM-2020-INCONSISTENCY-001",
      "source_type": "Elevation inconsistency record",
      "source_locator": "elevation-inconsistency-2020-dem-vs-lag.json",
      "acquisition_date": "2026-10-06",
      "processing_status": "RECORDED",
      "sha256": "pending",
      "notes": "Indiana GIO 2020 LiDAR DEM reads 364.0 ft at site vs owner-supplied LAG 377.2 ft (13.2 ft delta). Material inconsistency; requires PE/RLS-certified elevation to resolve. Reference only \u2014 not survey evidence."
    }
  ],
  "fema_loma_track": {
    "fema_letter_date": "2026-09-22",
    "loma_issued": false,
    "note": "Track fields record the packet's statements only. They do not assert FEMA's current case status; confirm via the FEMA case portal.",
    "response_deadline": "2026-12-21",
    "response_track_days": 90,
    "source": "TSM_Local_Admin_Packet_26-05-2022A.pdf (local floodplain admin packet; preserved artifact 26-05-2022A-092226.pdf sha256 8186cbf49bfa5ae415aacaf1b548f75fc02692a5793c30cdebb8cf7f6f20dcde)",
    "status": "ADDITIONAL_INFORMATION_REQUESTED"
  },
  "historical_timeline_track": [],
  "hydrologic_hypothesis_test": {
    "construction_modification_dates_documented": false,
    "counterfactual_model_completed": false,
    "fema_model_dependency_documented": false,
    "finding_status": "UNTESTED",
    "historical_navigation_function_documented": false,
    "hydraulic_difference_quantified": false,
    "infrastructure_identified": false,
    "operational_rules_documented": false,
    "reproducible_map_defect": false
  },
  "property_metadata": {
    "address": null,
    "community_id": null,
    "county": "Posey",
    "nearest_infrastructure_id": null,
    "parcel_id": null,
    "state": "IN",
    "structure_built_date": null
  },
  "schema_version": "tsm-nfip-layer2-v1",
  "site_constants_per_packet": {
    "berm_crest_navd88_ft": 379.8,
    "bfe_navd88_ft": 375.0,
    "community_id": "180209",
    "coordinates": {
      "lat": 37.845887,
      "lon": -88.005075
    },
    "ffe_navd88_ft": 382.5,
    "firm_panel": "18129C0265C",
    "lag_navd88_ft": 377.2,
    "note": "BFE 375.0 ft NAVD88 is the packet's stated value; do not substitute 368.7 from other documents without reconciliation.",
    "source": "TSM_Local_Admin_Packet_26-05-2022A.pdf"
  }
}